{
  "schema": 1,
  "articleId": "2026-10-20-en-coast-beyond-the-title",
  "lang": "en",
  "questions": [
    {
      "id": "q1",
      "sentenceId": "s1",
      "start": 110,
      "answer": "cooperation",
      "options": [
        "competition",
        "construction",
        "cooperation",
        "communication"
      ],
      "explanation": "cooperation意为合作，通常不可数；twenty-five years of cooperation指二十五年的合作。"
    },
    {
      "id": "q2",
      "sentenceId": "s4",
      "start": 135,
      "answer": "recognition",
      "options": [
        "recognition",
        "recovery",
        "resistance",
        "reduction"
      ],
      "explanation": "gain international recognition表示获得国际认可；recognition为不可数名词。"
    },
    {
      "id": "q3",
      "sentenceId": "s9",
      "start": 92,
      "answer": "habitats",
      "options": [
        "habits",
        "headings",
        "harbours",
        "habitats"
      ],
      "explanation": "habitats为habitat的复数，provide habitats for rare species表示为珍稀物种提供栖息地。"
    },
    {
      "id": "q4",
      "sentenceId": "s11",
      "start": 102,
      "answer": "statutory",
      "options": [
        "statistical",
        "statutory",
        "seasonal",
        "structural"
      ],
      "explanation": "statutory意为法定的，修饰designation；此处区分世界遗产地位与英国法定保护认定。"
    },
    {
      "id": "q5",
      "sentenceId": "s14",
      "start": 98,
      "answer": "stakeholders",
      "options": [
        "spectators",
        "successors",
        "stakeholders",
        "suppliers"
      ],
      "explanation": "stakeholders为利益相关方的复数，与a wide range of搭配；不是指观看庆典的观众。"
    }
  ]
}
